title,description,tags,last_update,publisher,contact_nam,contact_email,url,direct_url,license,comments,type,access,category
Circular Interno,Rotas. paradas e estimativa de horário do Circular interno.,,,,,,http://www.prefeitura.unicamp.br/servicos/diretoria-de-servicos-de-transporte/busca-circulares,,,,API,,Transporte
Lista de unidades acadêmicas,Lista das faculdades. institutos e centros de pesquisa.,,,Unicamp,,,http://www.unicamp.br/unicamp/faculdades-e-institutos,,,From the Harvard Fact Book,HTML,,Acadêmico
Cardápio de hoje dos Restaurantes Universitários (Bandecos),Cardápio do café-da-manhã (RU). almoço tradicional (RU. RA. RS) e vegetariano (RS) e jantar tradicional (RU. RA. RS) e vegetariano (RS) nos restaurantes universitários no campus de Campinas.,,10/30/15,Prefeitura do campus,,,http://www.prefeitura.unicamp.br/servicos/divisao-de-alimentacao/cardapio-dos-restaurantes,,,menus and nutritional information is presented on website and is not structured. open data (yet!),HTML,,Vida-estudantil
Catálogo de Cursos de Graduação,Catálogo dos cursos de graduação da Unicamp incluindo descrição dos cursos. currículo. ementa das disciplinas. coordenadorias de graduação e regimento geral dos cursos de graduação. Separado por ano de ingresso.,,2015,Unicamp,,,https://www.dac.unicamp.br/portal/graduacao/catalogos-de-cursos,,,Screenscrape with document.querySelectorAll('.course'),HTML,,acadêmico
Catálogo de Cursos de Pós-Graduação,Lista dos cursos de pós-graduação da Unicampca separados por unidade. Separado por ano de ingresso.,,2015,,,,https://www.dac.unicamp.br/portal/pos-graduacao/catalogos-de-cursos,,,Screenscrape with document.querySelectorAll('.course'),HTML,,acadêmico
Estatísticas do Vestibular,Estatísticas do Vestibular da Unicamp,,2017,Comvest,,,https://docs.google.com/a/unicamp.br/spreadsheets/d/1yzPJtL1lj8lV37-Mpp1YsykSiKRNE3blpGiqDuKmTTk,,,,Excel,,acadêmico
Estatísticas da Graduação e Pós-Graduação,Alunos matriculados na graduação. mestrado. doutorado e especialização desde 1989,,2017,,,,https://docs.google.com/a/unicamp.br/spreadsheets/d/1FOh3mDQh_sXHJQrjT2-7S61iR06VtyVz5-9OH4ncBH8,,,,Excel,,acadêmico
Centro de Ensino de Línguas,Demanda e alunos matriculados desde 1994,,2017,,,,https://docs.google.com/a/unicamp.br/spreadsheets/d/1-i1BKAa7HMXdw16jsPGv1gkq4hxLyVukqmq0T_MmZLI,,,,Excel,,acadêmico
Colégios Técnicos,Informações sobre o COTUCA e COTIL desde 1989,,2016,,,,https://docs.google.com/a/unicamp.br/spreadsheets/d/1ZR-QWdapxXS9BhfLahWcrQ9pQF2DHy-wvkclC9SyTFA,,,,Excel,,acadêmico
Extensão Universitária,Cursos e alunos matriculados desde 2003,,2016,,,,https://docs.google.com/a/unicamp.br/spreadsheets/d/1HCxDx_rz4HBcGXDe78xVvMa7lwOza49nprAwdzSHBhU,,,,Excel,,acadêmico
Produção Científica,Lista de produção científica. patentes. publicações indexadas e publicações por docentes desde 2000,,2016,,,,https://docs.google.com/a/unicamp.br/spreadsheets/d/1ZZS1hHnsNMoYclgGDvHHRTw-UfXkSuDTekAmgbCpYsw,,,,Excel,,acadêmico
Recursos Humanos,Listagem de docentes. não docentes e pesquisadores da Unicamp. Série histórica desde 1994,,2016,,,,https://docs.google.com/a/unicamp.br/spreadsheets/d/1RcdkY59gs-9dOI-bNGpxf1iIBsWxw41PcdWgTqvG-tE,,,,Excel,,acadêmico
Sistema de Bibliotecas,Informações sobre o acervo das bibliotecas da Unicamp desde 1989.,,2016,,,,https://docs.google.com/a/unicamp.br/spreadsheets/d/1VSqDtovIB-gwqsnnyP4KiF0wKj63JIU606yqKzM1c-c,,,,Excel,,acadêmico
Publicações Editadas,Informações desde 1989 sobre títulos. tiragem. edição própria e co-edição.,,2016,,,,https://docs.google.com/a/unicamp.br/spreadsheets/d/1nhaA6u2zUze1AAr9w6UEFHsXglcHNOE2Os4b7LGKjJo,,,,Excel,,acadêmico
Atendimentos à Comunidade Interna,Informações sobre atendimentos à comunidade interna.,,2016,,,,https://docs.google.com/a/unicamp.br/spreadsheets/d/16JKZjZoA7ghnSTUnHuWHitYMYD23VItlhV3MjRpcwXM,,,,Excel,,campus
Indicadores de desempenho,Indicadores de desempenho.,,2016,,,,https://docs.google.com/spreadsheets/d/1QrSw47tg6Kl1Bu6OYEozBy6nTb60JjF2-S3z83G4aOQ,,,,Excel,,acadêmico
Orçamento,Orçamento da Unicamp.,,2016,,,,https://docs.google.com/spreadsheets/d/1fz6buV3PIuhVwVD9dCh6CqC_VxBvsSoeh1V-Hqkkw-U,,,,Excel,,Finanças
Atendimento à comunidade externa,Atendimentos à comunidade externa da Unicamp.,,2016,,,,https://docs.google.com/spreadsheets/d/1orOOalmybpO3CWPbFdVfv0c4iMexC-3NFJATIJ3czcY,,,,Excel,,Campus
Área construída,Total de área construída na Unicamp. Informações anuais desde 1989.,,2016,,,,https://docs.google.com/spreadsheets/d/1MzFM5p6S9BxbJ-SwkPIvGvQKNVH7mKyY5Ev4rw8I014,,,,Excel,,Campus
Recursos da Área da Saúde,Origem e valor dos recursos que a Unicamp recebe para a área da saúde. (MC931),,2016,MC931,,,https://docs.google.com/spreadsheets/d/1whfZf8pr-SgSMieLSWwcdCoj8DUIO7N3H9HeoGhdlXY,,,,Excel,,Finanças
Bolsas de Assistência,Número de bolsistas por categoria na Unicamp. (MC931),,2016,MC931,,,https://docs.google.com/spreadsheets/d/1e28vh6nZR59g8cXvJjOtRKYWGRcyOzgu1YUgS5qveUE,,,,Excel,,Acadêmico
Estatísticas dos cursos,Ingressantes. matriculados e concluíntes por curso. (MC931).,,2016,MC931,,,https://docs.google.com/spreadsheets/d/16Z1E7JK4-9jiS1IxPKWFry9NGqt1iFkZIlRAorowOlM,,,,Excel,,Acadêmico
Auxílio Alimentação e transporte,Número de alunos atendidos pelos auxílios na Unicamp desde 2007,,2016,MC931,,,https://docs.google.com/spreadsheets/d/1N9C0bCDREK9UDq3_U4I_e_NYt6IWCT8PW2bLE4O27tE,,,,Excel,,Finanças
Informações sobre bolsas do CNPq,Número de bolsistas do CNPq. separados por área e nível.,,2016,MC931,,,https://docs.google.com/spreadsheets/d/1dHXEXnPymuaEgdwPuZdpQFaXYu0Uws_VW7WczSiLxFU,,,,Excel,,Acadêmico
Informações sobre bolsas do FAPESP,Número de bolsistas do FAPESP separados por área e nível.,,2016,MC931,,,https://docs.google.com/spreadsheets/d/1X0nHKYoE9RDCvspmwiDvHBCbvxhCXSfGLtFKdN3PDbY,,,,Excel,,Acadêmico
Moradia da Unicamp,Informações sobre o número de alunos e nível de curso dos alunos que estão na moradia da Unicamp.,,2016,MC931,,,https://docs.google.com/spreadsheets/u/2/d/1SrlyP9AMZHuVoHyt33iIKgDfdjj5-rVC8K2IO4mUgTw,,,,Excel,,Campus
Cidade de origem dos alunos de graduação da Unicamp,Listagem das cidades de onde os alunos da Unicamp cursaram o ensino médio.,,2016,MC931,,,https://docs.google.com/spreadsheets/d/1uOa0VVhjDSup3TQJUmEbD9uf0O8O6QzEhXiH1rdahAk,,,,Excel,,Acadêmico
Perfil socioeconomico dos inscritos e matriculados na Unicamp 2013,Perfil socioeconomico dos inscritos e matriculados na Unicamp 2013,,2013,MC931,,,https://drive.google.com/drive/u/2/folders/0B-Pr6fww6bm4V0paTjhsZk93YWs,,,,PDF,,Acadêmico
Perfil socioeconomico dos inscritos e matriculados na Unicamp 2014,Perfil socioeconomico dos inscritos e matriculados na Unicamp 2014,,2014,MC931,,,https://drive.google.com/drive/u/2/folders/0B-Pr6fww6bm4V0paTjhsZk93YWs,,,,PDF,,Acadêmico
Perfil socioeconomico dos inscritos e matriculados na Unicamp 2015,Perfil socioeconomico dos inscritos e matriculados na Unicamp 2015,,2015,MC931,,,https://drive.google.com/drive/u/2/folders/0B-Pr6fww6bm4V0paTjhsZk93YWs,,,,PDF,,Acadêmico
Perfil socioeconomico dos inscritos e matriculados na Unicamp 2016,Perfil socioeconomico dos inscritos e matriculados na Unicamp 2016,,2016,MC931,,,https://drive.google.com/drive/u/2/folders/0B-Pr6fww6bm4V0paTjhsZk93YWs,,,,PDF,,Acadêmico
Perfil socioeconomico dos inscritos e matriculados na Unicamp 2017,Perfil socioeconomico dos inscritos e matriculados na Unicamp 2017,,2017,MC931,,,https://drive.google.com/drive/u/2/folders/0B-Pr6fww6bm4V0paTjhsZk93YWs,,,,PDF,,Acadêmico
Relatório de acompanhamento do PROFIS,Relatório de acompanhamento do PROFIS. 2013-2015,,2016,MC931,,,https://drive.google.com/drive/u/2/folders/0B-Pr6fww6bm4V0paTjhsZk93YWs,,,,PDF,,Acadêmico
Números de atendimentos no SAPPE,Número de atendimentos nos serviços de apoio psiquiátrico da Unicamp (SAPPE),,2016,MC931,,,https://docs.google.com/spreadsheets/d/1jl4I-2WASGsCPVPrz5zu6sIgPb1B3Eb8zPO6H1Supfw,,,,Excel,,Acadêmico
Porcentagens de alunos e alunas na Unicamp,Porcentagens de alunos e alunas na Unicamp por unidade de ensino e pesquisa,,2016,MC931,,,https://docs.google.com/spreadsheets/d/1NHuIyztcQGXL2KYyHBN6A1my1aRuWxKBjKCiFk55pW4,,,,Excel,,Acadêmico
Alunos da Unicamp por curso e por sexo,Alunos da Unicamp por curso e por sexo,,2016,MC931,,,https://docs.google.com/spreadsheets/d/1Gj7sv5MFEq6hPJKlsKcIOth9UMgq730TyEaUZZ5VaLM,,,,Excel,,Acadêmico
Despesas da Unicamp em 2017,Dados do SIAFEM das despesas da Unicamp do ano de 2017,,2017,MC931,,,https://docs.google.com/spreadsheets/d/1wyF7M4g-rg-PKc5Z1PeuBbYoA22DewbklimcJqgiKfA,,,,Excel,,Finanças
Relação de vagas no PROFIS,Vagas no PROFIS,,2016,MC931,,,https://docs.google.com/spreadsheets/d/1yZC3SG0OghiW2pZAo_J-TOIjNV0Mm_bsUuIpPZFO2mE,,,,Excel,,Acadêmico
Dados orçamentários das unidades da Unicamp,Dados orçamentários das unidades da Unicamp,,2017,MC931,,,https://docs.google.com/spreadsheets/d/1tM24dkaStP-8E-uww1GEvVpKAhYdw5JoivvB-pBmlfU,,,,Excel,,Finanças
Valores das bolsas de auxílio da Unicamp,Valores das bolsas de auxílio da Unicamp,,2016,MC931,,,https://docs.google.com/spreadsheets/d/1Rm-EcG7NQP78502obcheXqEkmSgKMQDLSlj42ZMeuco,,,,Excel,,Finanças
Proposta orçamentária da Unicamp,Arquivos com as propostas orçamentárias da Unicamp desde 1999,,2016,AEPLAN,,,http://www.aeplan.unicamp.br/proposta_orcamentaria/orcamento.php,,,,PDF,,Finanças
Anuário Estatístico da Unicamp,Informações estatísticas da Unicamp desde 2005,,2016,AEPLAN,,,http://www.aeplan.unicamp.br/anuario/anuario.php,,,,PDF,,Acadêmico
Série histórica da arrecadação de ICMS,Comparativo da arrecadação de ICMS desde 1995,,2016,AEPLAN,,,http://www.aeplan.unicamp.br/icms_base_calculo_universidades/arrecadacao_icms.php,,,,PDF,,Finanças
Série histórica do orçamento das Unidades da Unicamp referentes ao PQO,Orçamento qualificado das Uniades da Unicamp desde 2002,,2016,AEPLAN,,,http://www.aeplan.unicamp.br/pqo/pqo.php,,,,PDF,,Finanças
Evolução de salários da Unicamp,Evolução de salários docentes e não docentes da Unicamp desde 1989,,2016,AEPLAN,,,http://www.aeplan.unicamp.br/evolucao_salarios/evolucao_salarios.php,,,,PDF,,Finanças
Classificação da despesa orçamentária por natureza,Descrição de como funciona o sistema de classificação de despesas orçamentárias da Unicamp,,2016,Governo do Estado de SP,,,http://www.aeplan.unicamp.br/classificacao_despesa/pdf/classificacao_despesa.pdf,,,,PDF,,Finanças
Recursos destinados a manutenção predial da Unicamp,Informações anuais. desde 2011. dos recursos destinados a manutenção predial na Unicamp,,2016,AEPLAN,,,http://www.aeplan.unicamp.br/pmp/pmp_ensino-pequisa.php,,,,PDF,,Finanças
Revisões orçamentárias da Unicamp,Lista de todas as revisões orçamentárias da Unicamp. desde 2006,,2016,AEPLAN,,,http://www.aeplan.unicamp.br/revisao_orcamentaria/revisao.php,,,,PDF,,Finanças
Informe AEPLAN,Informações de acompanhamento da arrecadação e despesas da Unicamp. desde 2002. periodicidade quase mensal,,2016,AEPLAN,,,http://www.aeplan.unicamp.br/informe_aeplan/informe.php,,,,PDF,,Finanças
Documentos sobre a situação financeira atual da Unicamp,Documentos sobre a situação financeira atual da Unicamp,,2017,PRDU,,,http://www.prdu.unicamp.br/dirigentes-unidades-orgaos/dirigentes-agenda,,,,PDF,,Finanças
Indicadores gerais da Unicamp,Inúmeras tabelas com indicadores gerais da Unicamp. alimentadas com grande frequência. diretamente das bases de dados da universidade.,,2017,PRDU,,,http://www.siarh.unicamp.br/indicadores/,,,,Excel,,Acadêmico
Pautas e Atas do Conselho Universitário (CONSU),Pautas e Atas do Conselho Universitário (CONSU),,2017,Secretaria Geral,,,http://www.sg.unicamp.br/consu/pautas-e-atas,,,,PDF,,Acadêmico
Pautas e Atas da Câmara de Ensino. Pesquisa e Extensão (CEPE),Pautas e Atas da Câmara de Ensino. Pesquisa e Extensão (CEPE),,2017,Secretaria Geral,,,http://www.sg.unicamp.br/camara/cepe/pautas-e-atas,,,,PDF,,Acadêmico
Pautas e Atas da Câmara de Administração (CAD),Pautas e Atas da Câmara de Administração (CAD),,2017,Secretaria Geral,,,http://www.sg.unicamp.br/camara/cad/pautas-e-atas,,,,PDF,,Acadêmico
Taxas administrativas cobradas pela Unicamp,Taxas administrativas cobradas pela Unicamp,,2017,Secretaria Geral,,,http://www.sg.unicamp.br/camara/cad/taxas-administrativas,,,,PDF,,Finanças
Pautas e Atas da Câmara de Orçamento e Patrimônio da Unicamp (COP),Pautas e Atas da Câmara de Orçamento e Patrimônio da Unicamp (COP),,2017,Secretaria Geral,,,http://www.sg.unicamp.br/comissoes/cop/pautas-atas-e-pareceres,,,,PDF,,Finanças
Diretoria Acadêmica,Informações sobre disciplinas. catálogos de cursos. alunos matriculados. entre outros,,2017,DAC,,,https://www.dac.unicamp.br/portal/,,,,PDF,,Acadêmico
Folha de Pagamento da Unicamp,Folha de pagamento mensal da Unicamp,,2017,DGRH,,,https://www.unicamp.br/unicamp/informacao/remuneracao-unicamp,,,,PDF,,Finanças
Despesas da Unicamp conforme o SIAFEM,Despesas da Unicamp,,2017,SIAFEM,,,https://www.fazenda.sp.gov.br/SigeoLei131/Paginas/FlexConsDespesa.aspx,,,,API,,Finanças
Receitas da Unicamp conforme o SIAFEM,Receitas da Unicamp,,2017,SIAFEM,,,https://www.fazenda.sp.gov.br/SigeoLei131/Paginas/FlexConsReceita.aspx,,,,API,,Finanças
Relação de bens da Unicamp,Relação de bens da Unicamp,,2017,DGA,,,https://drive.google.com/drive/u/2/folders/0B-Pr6fww6bm4V0paTjhsZk93YWs,,,,Excel,,Finanças
